indicator,Data,Notes,,,,,
description,Indicators from  Bookmark feature attack (CVE-2020-15069) documented in Pacific Rim Attack,: https://news.sophos.com/en-us/2024/10/31/pacific-rim-timeline/,,,,,
md5,8a721d68f181c2274c3bb3f34cb492ed,Hash of Perl web shell (MITRE ATT&CK Tactic: Persistence),,,,,
filename,patch.sh ,"Disables hotfix on devices, running at 5-minute intervals (MITRE ATT&CK Tactic: Impact)",,,,,
filename,IC.sh,Collected and exfiltrated user account data (MITRE ATT&CK Tactic:Exfiltration),,,,,
sha1,9a5ed7a3319e99698cb7f3a4b98ccb1dd19202b8,patch.sh (MITRE ATT&CK Tactic: Impact),,,,,
sha1,be18ca11b18cee2764b25cb61c6e8f1ead9fa1f6,IC.sh ((MITRE ATT&CK Tactic: Exfiltration),,,,,
ip_port,182.16.103.91:90,IP contacted by IC.sh (MITRE ATT&CK Tactic: Exfiltration),,,,,